{
  "fact_set_id": "FS-PRODUCT-CRD04b-P08",
  "fact_type": "PRODUCT_FACTS",
  "brand_id": "fixture-brand-01",
  "version": 1,
  "schema_version": "A-3.2-v2",
  "updated_at": "2026-08-18T16:30:00+08:00",
  "updated_by_role": "BRAND_OPERATOR",
  "product_id": "P08",
  "name": {
    "status": "CONFIRMED",
    "value": "V口翻领短袖 Polo",
    "source_refs": [
      {
        "source_id": "SRC-CRD04b-0001",
        "brand_id": "fixture-brand-01",
        "source_type": "BRAND_OPERATOR_INPUT",
        "locator": "夹具虚构-剧本",
        "captured_at": "2026-08-17T00:00:00+08:00",
        "checksum": null
      }
    ]
  },
  "category": {
    "status": "CONFIRMED",
    "value": "V口翻领",
    "source_refs": [
      {
        "source_id": "SRC-CRD04b-0002",
        "brand_id": "fixture-brand-01",
        "source_type": "IMAGE_INPUT",
        "locator": "截图 IMG_0652",
        "captured_at": "2026-08-17T00:00:00+08:00",
        "checksum": null
      }
    ]
  },
  "sku": {
    "status": "CONFIRMED",
    "value": "1G4901591",
    "source_refs": [
      {
        "source_id": "SRC-CRD04b-0002",
        "brand_id": "fixture-brand-01",
        "source_type": "IMAGE_INPUT",
        "locator": "截图 IMG_0652",
        "captured_at": "2026-08-17T00:00:00+08:00",
        "checksum": null
      }
    ]
  },
  "price": {
    "status": "CONFIRMED",
    "value": {
      "amount": 498,
      "currency": "CNY",
      "as_of": "2026-08-17T00:00:00+08:00"
    },
    "source_refs": [
      {
        "source_id": "SRC-CRD04b-0003",
        "brand_id": "fixture-brand-01",
        "source_type": "IMAGE_INPUT",
        "locator": "截图 IMG_0652（数据包字段名「吊牌价」，截图原文「498元」）",
        "captured_at": "2026-08-17T00:00:00+08:00",
        "checksum": null
      }
    ]
  },
  "material": {
    "status": "CONFIRMED",
    "value": [
      "藏青面料:37.8%粘纤 31.6%棉 25.4%腈纶 5.2%氨纶",
      "本白色面料:36.8%粘纤 30.9%棉 27.4%腈纶 4.9%氨纶"
    ],
    "source_refs": [
      {
        "source_id": "SRC-CRD04b-0002",
        "brand_id": "fixture-brand-01",
        "source_type": "IMAGE_INPUT",
        "locator": "截图 IMG_0652",
        "captured_at": "2026-08-17T00:00:00+08:00",
        "checksum": null
      }
    ]
  },
  "style_attributes": {
    "status": "CONFIRMED",
    "value": [
      "V口翻领",
      "短袖",
      "修身轮廓"
    ],
    "source_refs": [
      {
        "source_id": "SRC-CRD04b-0004",
        "brand_id": "fixture-brand-01",
        "source_type": "IMAGE_INPUT",
        "locator": "截图 IMG_0655 / 截图 IMG_0662（数据包「版型风格特征」——已确认文字事实，本快照不提供其图片实体）",
        "captured_at": "2026-08-17T00:00:00+08:00",
        "checksum": null
      }
    ]
  },
  "selling_points": {
    "status": "CONFIRMED",
    "value": [
      "单品图确认 V 口翻领、短袖",
      "藏青与本白两种面料成分分别列示"
    ],
    "source_refs": [
      {
        "source_id": "SRC-CRD04b-0005",
        "brand_id": "fixture-brand-01",
        "source_type": "IMAGE_INPUT",
        "locator": "截图 IMG_0652 / 截图 IMG_0662（数据包「已确认卖点」）",
        "captured_at": "2026-08-17T00:00:00+08:00",
        "checksum": null
      }
    ]
  },
  "size_range": {
    "status": "CONFIRMED",
    "value": [
      "S",
      "M",
      "L",
      "XL"
    ],
    "source_refs": [
      {
        "source_id": "SRC-CRD04b-0002",
        "brand_id": "fixture-brand-01",
        "source_type": "IMAGE_INPUT",
        "locator": "截图 IMG_0652",
        "captured_at": "2026-08-17T00:00:00+08:00",
        "checksum": null
      }
    ]
  },
  "lifecycle_stage": {
    "status": "CONFIRMED",
    "value": "正常在售",
    "source_refs": [
      {
        "source_id": "SRC-CRD04b-0001",
        "brand_id": "fixture-brand-01",
        "source_type": "BRAND_OPERATOR_INPUT",
        "locator": "夹具虚构-剧本",
        "captured_at": "2026-08-17T00:00:00+08:00",
        "checksum": null
      }
    ]
  },
  "inventory": {
    "status": "CONFIRMED",
    "value": {
      "value": 240,
      "unit": "件",
      "as_of": "2026-08-17T00:00:00+08:00"
    },
    "source_refs": [
      {
        "source_id": "SRC-CRD04b-0001",
        "brand_id": "fixture-brand-01",
        "source_type": "BRAND_OPERATOR_INPUT",
        "locator": "夹具虚构-剧本",
        "captured_at": "2026-08-17T00:00:00+08:00",
        "checksum": null
      }
    ]
  },
  "image_refs": []
}
